{
  "schema_version": "path-planner-v3-planning-request/v1",
  "request_id": "shared-core-case-a",
  "request_time": {
    "clock_id": "mission",
    "tick_ns": "1000"
  },
  "state_time": {
    "clock_id": "mission",
    "tick_ns": "1000"
  },
  "frame_id": "map",
  "platform_type": "WHEELED",
  "current_state": {
    "position_m": [1.5, 3.5, 0.0],
    "yaw_rad": 0.0,
    "linear_velocity_mps": [0.0, 0.0, 0.0],
    "yaw_rate_radps": 0.0,
    "error_bounds": {
      "position_bound_m": {
        "shape": "euclidean_ball",
        "center": [0.0, 0.0, 0.0],
        "radius": 0.05
      },
      "yaw_bound_rad": {
        "shape": "symmetric_interval",
        "center": 0.0,
        "half_width": 0.01
      },
      "linear_velocity_bound_mps": {
        "shape": "euclidean_ball",
        "center": [0.0, 0.0, 0.0],
        "radius": 0.01
      },
      "yaw_rate_bound_radps": {
        "shape": "symmetric_interval",
        "center": 0.0,
        "half_width": 0.01
      }
    }
  },
  "goal": {
    "goal_id": "case-a-goal",
    "target": {
      "kind": "POINT_WITH_TOLERANCE",
      "position_m": [7.5, 3.5, 0.0],
      "position_tolerance_m": 0.1
    },
    "task_metadata": []
  },
  "map_snapshot": {
    "snapshot_ref": {
      "id": "case-a-map",
      "revision": 7,
      "content_hash": "aaaaaaaaaaaaaaaaaaaaaaaaaaaaaaaaaaaaaaaaaaaaaaaaaaaaaaaaaaaaaaaa"
    },
    "frame_id": "map",
    "source_time": {
      "clock_id": "mission",
      "tick_ns": "1000"
    },
    "map_revision": 7,
    "bounds": {
      "minimum_m": [0.0, 0.0, -1.0],
      "maximum_m": [8.0, 8.0, 1.0]
    },
    "resolution_m": 1.0,
    "layer_manifest": [
      {
        "layer_name": "KNOWN_MASK",
        "content_ref": {
          "id": "case-a-known",
          "revision": 1,
          "content_hash": "1111111111111111111111111111111111111111111111111111111111111111"
        }
      },
      {
        "layer_name": "ELEVATION",
        "content_ref": {
          "id": "case-a-elevation",
          "revision": 1,
          "content_hash": "2222222222222222222222222222222222222222222222222222222222222222"
        }
      },
      {
        "layer_name": "TERRAIN_NORMAL",
        "content_ref": {
          "id": "case-a-normal",
          "revision": 1,
          "content_hash": "3333333333333333333333333333333333333333333333333333333333333333"
        }
      },
      {
        "layer_name": "ROUGHNESS",
        "content_ref": {
          "id": "case-a-roughness",
          "revision": 1,
          "content_hash": "4444444444444444444444444444444444444444444444444444444444444444"
        }
      },
      {
        "layer_name": "HARD_OBSTACLE",
        "content_ref": {
          "id": "case-a-obstacle",
          "revision": 1,
          "content_hash": "5555555555555555555555555555555555555555555555555555555555555555"
        }
      },
      {
        "layer_name": "CONFIDENCE",
        "content_ref": {
          "id": "case-a-confidence",
          "revision": 1,
          "content_hash": "6666666666666666666666666666666666666666666666666666666666666666"
        }
      }
    ],
    "immutable_data_handle": "case-a-map-data"
  },
  "safety_capability_ref": {
    "id": "case-a-wheel-capability",
    "revision": 3,
    "content_hash": "dddddddddddddddddddddddddddddddddddddddddddddddddddddddddddddddd"
  },
  "algorithm_config_ref": {
    "id": "case-a-algorithm-config",
    "revision": 5,
    "content_hash": "eeeeeeeeeeeeeeeeeeeeeeeeeeeeeeeeeeeeeeeeeeeeeeeeeeeeeeeeeeeeeeee"
  },
  "learned_cost_snapshot": {
    "snapshot_ref": {
      "id": "case-a-learned-snapshot",
      "revision": 2,
      "content_hash": "ffffffffffffffffffffffffffffffffffffffffffffffffffffffffffffffff"
    },
    "registry_handle": "case-a-learned-data",
    "ready_before_request": true,
    "hard_feasibility_authority": "NONE"
  }
}
