{
  "schema_version": "path-planner-v3-planning-request/v1",
  "request_id": "request-1",
  "request_time": {
    "clock_id": "mission-clock",
    "tick_ns": "9007199254740993"
  },
  "state_time": {
    "clock_id": "mission-clock",
    "tick_ns": "9007199254740992"
  },
  "frame_id": "map",
  "platform_type": "WHEELED",
  "current_state": {
    "position_m": [0.0, 0.0, 0.0],
    "yaw_rad": 0.0,
    "linear_velocity_mps": [0.0, 0.0, 0.0],
    "yaw_rate_radps": 0.0,
    "error_bounds": {
      "position_bound_m": {
        "shape": "euclidean_ball",
        "center": [0.0, 0.0, 0.0],
        "radius": 0.1
      },
      "yaw_bound_rad": {
        "shape": "symmetric_interval",
        "center": 0.0,
        "half_width": 0.01
      },
      "linear_velocity_bound_mps": {
        "shape": "euclidean_ball",
        "center": [0.0, 0.0, 0.0],
        "radius": 0.05
      },
      "yaw_rate_bound_radps": {
        "shape": "symmetric_interval",
        "center": 0.0,
        "half_width": 0.01
      }
    }
  },
  "goal": {
    "goal_id": "goal-1",
    "target": {
      "kind": "POINT_WITH_TOLERANCE",
      "position_m": [5.0, 1.0, 0.0],
      "position_tolerance_m": 0.25
    },
    "task_metadata": []
  },
  "map_snapshot": {
    "snapshot_ref": {
      "id": "map-snapshot-1",
      "revision": 1,
      "content_hash": "aaaaaaaaaaaaaaaaaaaaaaaaaaaaaaaaaaaaaaaaaaaaaaaaaaaaaaaaaaaaaaaa"
    },
    "frame_id": "map",
    "source_time": {
      "clock_id": "mission-clock",
      "tick_ns": "9007199254740990"
    },
    "map_revision": 1,
    "bounds": {
      "minimum_m": [-10.0, -10.0, -1.0],
      "maximum_m": [10.0, 10.0, 2.0]
    },
    "resolution_m": 0.25,
    "layer_manifest": [
      {
        "layer_name": "KNOWN_MASK",
        "content_ref": {
          "id": "known-mask-1",
          "revision": 1,
          "content_hash": "dddddddddddddddddddddddddddddddddddddddddddddddddddddddddddddddd"
        }
      }
    ],
    "immutable_data_handle": "map-handle-1"
  },
  "safety_capability_ref": {
    "id": "wheel-capability-1",
    "revision": 1,
    "content_hash": "bbbbbbbbbbbbbbbbbbbbbbbbbbbbbbbbbbbbbbbbbbbbbbbbbbbbbbbbbbbbbbbb"
  },
  "algorithm_config_ref": {
    "id": "planner-config-1",
    "revision": 1,
    "content_hash": "cccccccccccccccccccccccccccccccccccccccccccccccccccccccccccccccc"
  }
}
